Class,@type,variable,description,authenticated,marginality,cardinality,type,enumeration,minimum,maximum,derived_from,schema:sameAs
cvisb:PostalAddress,rdf:Property,addressRegion,"The region (e.g. state/Adm 2). For example, CA.",False,required,one,"xsd:string, schema:Text",,,,,schema:addressRegion
cvisb:PostalAddress,rdf:Property,postalCode,"The postal code. For example, 94043.",False,required,one,"xsd:string, schema:Text",,,,,schema:postalCode
cvisb:PostalAddress,rdf:Property,addressCountry,"The country object (containing name, ISO code/identifier, link to ISO page)",False,required,one,cvisb:Country,,,,,schema:addressCountry
,rdfs:Class,RDT,A schema describing a rapid diagnostic test result for a Patient in the Center for Viral Systems Biology experiments,,,,,,,,schema:Thing,
cvisb:RDT,rdf:Property,virus,Virus tested in ELISA (Ebola or Lassa),True,required,one,schema:Text,"['Ebola', 'Lassa']",,,,
cvisb:RDT,rdf:Property,RDTresult,"Result of RDT, either positive/negative",True,required,one,schema:Text,"['positive', 'negative', 'indeterminate']",,,,
,rdfs:Class,RTPCR,A schema describing a RT-PCR result for a Patient in the Center for Viral Systems Biology experiments,,,,,,,,schema:Thing,
cvisb:RTPCR,rdf:Property,virus,Virus tested in RT-PCR (Ebola or Lassa),True,required,one,schema:Text,"['Ebola', 'Lassa']",,,,
cvisb:RTPCR,rdf:Property,RTPCRresult,"Result of RT-PCR, either positive/negative/indeterminate",True,required,one,schema:Text,"['positive', 'negative', 'indeterminate']",,,,
cvisb:RTPCR,rdf:Property,RTPCRvalue,"Result of RT-PCR, Ct value",True,recommended,one,schema:Number,,,,,
cvisb:RTPCR,rdf:Property,viralLoad,"viral load, in copies/ml",True,recommended,one,schema:Number,,,,,
,rdfs:Class,RepertoireSequencing,A schema describing a repertoire sequencing Experiment in the Center for Viral Systems Biology,,,,,,,,cvisb:sequencingExperiment,
cvisb:RepertoireSequencing,rdf:Property,cellType,Whether the repertoire sequencing was performed on B-cells or T-cells,False,required,one,"xsd:string, schema:Text","['B-cell', 'T-cell']",,,,
cvisb:RepertoireSequencing,rdf:Property,primerSet,Primer set,False,recommended,one,"xsd:string, schema:Text",,,,,
cvisb:RepertoireSequencing,rdf:Property,analysisVersion,Analysis pipeline version,False,recommended,one,"xsd:string, schema:Text",,,,,
cvisb:RepertoireSequencing,rdf:Property,abstarVersion,Abstar Version,False,recommended,one,"xsd:string, schema:Text",,,,,
cvisb:RepertoireSequencing,rdf:Property,germlineDatabase,germline database name or URL,False,recommended,one,"xsd:string, schema:Text",,,,,
cvisb:RepertoireSequencing,rdf:Property,germlineDBVersion,Germline database version,False,recommended,one,"xsd:string, schema:Text",,,,,
,rdfs:Class,RespiratoryRate,A schema describing a single respiratory rate datapoint collected from patients in the Center for Viral Systems Biology.,,,,,,,,cvisb:Data,
cvisb:RespiratoryRate,rdf:Property,time,Date and time of RespiratoryRate measurement,True,recommended,one,schema:DateTime,,,,,
cvisb:RespiratoryRate,rdf:Property,respiratoryRate,"RespiratoryRate, in breaths per minute",True,required,one,schema:Integer,,,,,
cvisb:RespiratoryRate,rdf:Property,collectionInstrument,Whether the measurement was recorded using a PhysIQ sensor or a conventional measurement by a nurse/doctor,True,recommended,one,schema:Text,"['PhysIQ', 'conventional']",,,,
,rdfs:Class,SNPData,A schema describing viral sequencing data in the Center for Viral Systems Biology.,,,,,,,,cvisb:Data,
cvisb:SNPData,rdf:Property,SNP,"Single nucleotide polymorphism, e.g. Q9H",False,required,one,"xsd:string, schema:Text",,,,,
cvisb:SNPData,rdf:Property,SNPdetected,Whether or not the SNP was found in the sequencing,False,required,one,schema:Boolean,,,,,
cvisb:SNPData,rdf:Property,SNPlocation,"Amino acid number of the SNP, relative to the reference sequence.",False,optional,one,schema:Integer,,,,,
cvisb:SNPData,rdf:Property,originalAA,Amino acid code for the amino acid at the reference sequence.,False,optional,one,schema:Text,,,,,
cvisb:SNPData,rdf:Property,mutatedAA,Amino acid code for the amino acid at the mutation site.,False,optional,one,schema:Text,,,,,
,rdfs:Class,Sample,"A schema describing a sample the Center for Viral Systems Biology. Primary samples = blood draw, tissue sample, urine, or feces.  Derived are some sort of isolation/preparation of whole blood/tissue, e.g. plasma, sera, DNA, RNA, etc.",,,,,,,,cvisb:Thing,
cvisb:Sample,rdf:Property,sampleID,"unique ID for the derived sample; ideally, the combination of sampleType and isolationDate. Should *not* contain non-public IDs.",True,required,one,"xsd:string, schema:Text",,,,,
cvisb:Sample,rdf:Property,sampleLabel,"Label for what the sample is called on sample tubes, etc.",True,required,one,"xsd:string, schema:Text",,,,,
cvisb:Sample,rdf:Property,alternateIdentifier,Alternate identifers for sample. Can contain private IDs.,True,optional,many,"xsd:string, schema:Text",,,,,schema:alternateIdentifier
cvisb:Sample,rdf:Property,name,Descriptive name of the derived sample,True,optional,one,"xsd:string, schema:Text",,,,,schema:name
cvisb:Sample,rdf:Property,description,Short description of the derived sample,True,optional,one,"xsd:string, schema:Text",,,,,schema:description
cvisb:Sample,rdf:Property,privatePatientID,"Unique *private* patient id, e.g. G-number, S-number, C-number",True,required,one,"xsd:string, schema:Text",,,,,
cvisb:Sample,rdf:Property,visitCode,"Visit code for the patient (day post hospitalization of blood draw for patients, visit number after initial for follow-up/contact)",False,recommended,one,"xsd:string, schema:Text",,,,,
cvisb:Sample,rdf:Property,isolationDate,"Date of sample creation/collection (NOT date of blood draw/tissue collection, unless the sample is that primary sample) (YYYY-MM-DD)",True,required,one,schema:Date,,,,,
cvisb:Experiment,rdf:Property,samplingDate,Date of sample collection used for the the experiment.,False,required,one,schema:Date,,,,,
cvisb:Sample,rdf:Property,sampleGroup,"Sample group type: whether it comes from the *acute* phase while the patient treated in the hospital, or from the *survivor* study where survivors and contacts of the survivors are sampled after the infection.",False,recommended,one,"xsd:string, schema:Text","['acute', 'survivor', None]",,,,
cvisb:Sample,rdf:Property,sampleType,"Sample type. Primary types: ""blood_purple-EDTA"", ""blood_blue-citrate"", ""blood_mixed"", ""blood_unknown"", ""urine"", ""feces"", ""organs"", ""tissue""; Derived types: ""plasma"", ""serum"", ""buffy coat"", ""PBMC"", ""frozenPBMC-DNA"", ""frozenPBMC-RNA"", ""viralRNA"", ""totalRNA"", ""DNA""",False,required,one,"xsd:string, schema:Text","['blood_purple-EDTA', 'blood_blue-citrate', 'blood_mixed', 'blood_unknown', 'urine', 'feces', 'organs', 'tissue', 'plasma', 'serum', 'plasma_or_serum', 'buffy_coat', 'PBMC', 'frozenPBMC-DNA', 'frozenPBMC-RNA', 'viralRNA', 'totalRNA', 'DNA']",,,,
cvisb:Sample,rdf:Property,derivedIndex,"Integer expressing how far derived the sample is from the primary sample.  Primary sample (e.g. blood draw) has a derivedIndex=0; PBMC=1, ...",False,recommended,one,schema:Integer,,,,,
cvisb:Sample,rdf:Property,species,Source of sample (human or rat),False,recommended,one,"xsd:string, schema:Text","['human', 'rat', 'monkey', None]",,,,
cvisb:Sample,rdf:Property,protocolVersion,Protocol version to isolate sample; either file name and/or version,False,optional,many,"xsd:string, schema:Text",,,,,
cvisb:Sample,rdf:Property,protocolURL,Link to protocol used to isolate sample,False,optional,many,"xsd:string, schema:Text",,,,,
cvisb:Sample,rdf:Property,freezingBuffer,What buffer was used to freeze the sample in; relevant for PBMC samples,False,optional,one,"xsd:string, schema:Text",,,,,
cvisb:Sample,rdf:Property,dilutionFactor,How much a plamsa sample has been diluted from its original isolation,False,optional,one,"xsd:string, schema:Text",,,,,
cvisb:Sample,rdf:Property,AVLinactivated,Whether a plasma or serum sample is AVL-inactivated,False,optional,one,schema:Boolean,,,,,
cvisb:Sample,rdf:Property,location,"Current location(s) for the sample, including Lab, number of aliquots, and when the info was last updated",True,required,many,cvisb:SampleLocation,,,,,
cvisb:Sample,rdf:Property,dateModified,Date of last update (YYYY-MM-DD),False,required,one,schema:Date,,,,,schema:dateModified
cvisb:Sample,rdf:Property,updatedBy,Person who updated the sample location,True,recommended,one,"xsd:string, schema:Text",,,,,
cvisb:Sample,rdf:Property,_version,"Version number of sample, auto-assigned by CViSB database",False,recommended,one,schema:Number,,,,,schema:version
,rdfs:Class,SampleLocation,A schema describing a the location of a sample in the Center for Viral Systems Biology,,,,,,,,schema:Place,
cvisb:SampleLocation,rdf:Property,lab,Current location of sample,True,required,one,"xsd:string, schema:Text","['KGH', 'TSRI-Andersen', 'MGH-Alter', 'TSRI-Briney', 'TSRI-Sullivan', 'Tulane-Schieffelin', 'Tulane-Garry']",,,,
cvisb:SampleLocation,rdf:Property,numAliquots,"Number of aliquots for a particular sampleID at a particular lab location. If sample has been used up, numAliquots = 0",True,required,one,schema:Integer,,,,,
cvisb:SampleLocation,rdf:Property,freezerID,Freezer in which the sample is located within the lab.,True,optional,many,schema:Text,,,,,
cvisb:SampleLocation,rdf:Property,freezerRack,Rack in the freezer in which the sample is located within the lab.,True,optional,many,schema:Text,,,,,
cvisb:SampleLocation,rdf:Property,freezerBox,Box in the rack/freezer in which the sample is located within the lab.,True,optional,many,schema:Text,,,,,
cvisb:SampleLocation,rdf:Property,freezerBoxCell,"Cell within the freezer box in which the sample is located within the lab, for example ""C12"".",True,optional,many,schema:Text,,,,,
cvisb:SampleLocation,rdf:Property,dateModified,Date of last update (YYYY-MM-DD),True,required,one,schema:Date,,,,,schema:dateModified
cvisb:SampleLocation,rdf:Property,updatedBy,Person who updated the sample location,True,required,one,"xsd:string, schema:Text",,,,,
,rdfs:Class,ScholarlyArticle,A schema describing a ScholarlyArticle (a.k.a a paper) in the Center for Viral Systems Biology,,,,,,,,schema:ScholarlyArticle,schema:ScholarlyArticle
cvisb:ScholarlyArticle,rdf:Property,identifier,DOI for publication,False,recommended,one,schema:Text,,,,,schema:identifier
cvisb:ScholarlyArticle,rdf:Property,url,url for publication,False,required,one,schema:URL,,,,,schema:url
cvisb:ScholarlyArticle,rdf:Property,author,Author list of publication,False,recommended,many,cvisb:Person,,,,,schema:author
cvisb:ScholarlyArticle,rdf:Property,name,Name of article,False,recommended,one,schema:Text,,,,,schema:name
cvisb:ScholarlyArticle,rdf:Property,datePublished,Date when the ScholarlyArticle was published,False,recommended,one,schema:Date,,,,,schema:datePublished
cvisb:ScholarlyArticle,rdf:Property,pageStart,"The page on which the work ends; for example ""135"" or ""xiii"".",False,recommended,one,schema:Text,,,,,schema:pageStart
cvisb:ScholarlyArticle,rdf:Property,pageEnd,"The page on which the work ends; for example ""138"" or ""xvi"".",False,recommended,one,schema:Text,,,,,schema:pageEnd
cvisb:ScholarlyArticle,rdf:Property,journalName,Name of journal/publication of the article,False,recommended,one,schema:Text,,,,,
cvisb:ScholarlyArticle,rdf:Property,issueNumber,"Identifies the issue of publication; for example, ""iii"" or ""2"".",False,recommended,one,schema:Text,,,,,schema:issueNumber
cvisb:ScholarlyArticle,rdf:Property,volumeNumber,"Identifies the volume of publication or multi-part work; for example, ""iii"" or ""2"".",False,recommended,one,schema:Text,,,,,schema:volumeNumber
,rdfs:Class,SequencingExperiment,A schema describing a Sequencing Experiment in the Center for Viral Systems Biology,,,,,,,,cvisb:Experiment,
cvisb:SequencingExperiment,rdf:Property,sequencingTechnology,Sequencing Technology (e.g. Illumina),False,recommended,one,"xsd:string, schema:Text",,,,,
cvisb:SequencingExperiment,rdf:Property,sequencingPlatform,Sequencing Platform (e.g. MiSeq),False,recommended,one,"xsd:string, schema:Text",,,,,
cvisb:SequencingExperiment,rdf:Property,instrumentID,Sequencing instrument ID,False,recommended,one,"xsd:string, schema:Text",,,,,
cvisb:SequencingExperiment,rdf:Property,sequencingCenter,"Sequencing Center (e.g. TSRI, Broad)",False,recommended,one,"xsd:string, schema:Text",,,,,
cvisb:SequencingExperiment,rdf:Property,readLength,read length,False,recommended,one,schema:Integer,,,,,
,rdfs:Class,SkinTemperature,A schema describing a single skin temperature datapoint collected from patients in the Center for Viral Systems Biology.,,,,,,,,cvisb:Data,
cvisb:SkinTemperature,rdf:Property,time,Date and time of SkinTemperature measurement,True,recommended,one,schema:DateTime,,,,,
cvisb:SkinTemperature,rdf:Property,skinTemperature,"Skin temperature, in degrees Celsius",True,required,one,schema:Float,,,,,
cvisb:SkinTemperature,rdf:Property,collectionInstrument,Whether the measurement was recorded using a PhysIQ sensor or a conventional measurement by a nurse/doctor,True,recommended,one,schema:Text,"['PhysIQ', 'conventional']",,,,
,rdfs:Class,SoftwareSourceCode,A schema describing SoftwareSourceCode in the Center for Viral Systems Biology,,,,,,,,schema:SoftwareSourceCode,schema:SoftwareSourceCode
cvisb:SoftwareSourceCode,rdf:Property,identifier,DOI or unique identifier for code,False,optional,one,"xsd:string, schema:Text",,,,,schema:identifier
cvisb:SoftwareSourceCode,rdf:Property,@id,"A unique identifier for the software code, preferably a DOI",False,recommended,one,schema:URL,,,,,schema:identifier
cvisb:SoftwareSourceCode,rdf:Property,name,Name of code,False,recommended,one,"xsd:string, schema:Text",,,,,schema:name
cvisb:SoftwareSourceCode,rdf:Property,description,Description of code,False,optional,one,"xsd:string, schema:Text",,,,,schema:description
cvisb:SoftwareSourceCode,rdf:Property,codeRepository,"Link to the repository where the un-compiled, human readable code and related code is located (SVN, github, CodePlex).",False,required,one,schema:URL,,,,,schema:codeRepository
cvisb:SoftwareSourceCode,rdf:Property,programmingLanguage,Computer programming language.,False,optional,many,"xsd:string, schema:Text",,,,,schema:programmingLanguage
cvisb:SoftwareSourceCode,rdf:Property,author,Author(s) of the code repository,False,recommended,many,"cvisb:Person, cvisb:Organization",,,,,schema:author
cvisb:SoftwareSourceCode,rdf:Property,publication,"Journal article or other publication associated with the dataset (stored as an object, not a string)",False,recommended,many,cvisb:ScholarlyArticle,,,,,schema:publication
cvisb:SoftwareSourceCode,rdf:Property,citation,Citation string (not an object) for the journal article or other publication associated with the dataset,False,recommended,many,schema:Text,,,,,schema:citation
cvisb:SoftwareSourceCode,rdf:Property,version,Software version,False,recommended,one,schema:Text,,,,,schema:version
cvisb:SoftwareSourceCode,rdf:Property,license,Computer programming language.,False,recommended,one,"schema:URL, xsd:string, schema:Text",,,,,schema:license
cvisb:SoftwareSourceCode,rdf:Property,datePublished,Date of first broadcast/publication,False,recommended,one,schema:Date,,,,,schema:datePublished
cvisb:SoftwareSourceCode,rdf:Property,dateModified,Date on which the code was most recently modified,False,recommended,one,schema:Date,,,,,schema:dateModified
,rdfs:Class,Symptom,A schema describing an Symptom for a Patient in the Center for Viral Systems Biology experiments,,,,,,,,schema:Thing,
cvisb:Symptom,rdf:Property,joint_pain,If the patient reports joint pain,True,optional,one,schema:Boolean,,,,,
cvisb:Symptom,rdf:Property,muscle_pain,If the patient reports muscle pain,True,optional,one,schema:Boolean,,,,,
cvisb:Symptom,rdf:Property,abdominal_pain,If the patient reports abdominal pain,True,optional,one,schema:Boolean,,,,,
cvisb:Symptom,rdf:Property,back_pain,If the patient reports back pain,True,optional,one,schema:Boolean,,,,,
cvisb:Symptom,rdf:Property,side_pain,If the patient reports side pain,True,optional,one,schema:Boolean,,,,,
cvisb:Symptom,rdf:Property,retrosternal_pain,If the patient reports retrosternal pain,True,optional,one,schema:Boolean,,,,,
cvisb:Symptom,rdf:Property,eye_pain,If the patient reports eye pain,True,optional,one,schema:Boolean,,,,,
cvisb:Symptom,rdf:Property,other_pain,If the patient reports other pain,True,optional,many,schema:Text,,,,,
cvisb:Symptom,rdf:Property,hearing_loss,If the patient reports hearing loss,True,optional,one,schema:Boolean,,,,,
cvisb:Symptom,rdf:Property,ringing_in_ears,If the patient reports ringing in ears,True,optional,one,schema:Boolean,,,,,
cvisb:Symptom,rdf:Property,dry_eyes,If the patient reports dry eyes,True,optional,one,schema:Boolean,,,,,
cvisb:Symptom,rdf:Property,burning_eyes,If the patient reports burning in eyes,True,optional,one,schema:Boolean,,,,,
cvisb:Symptom,rdf:Property,vision_loss,If the patient reports vision loss,True,optional,one,schema:Boolean,,,,,
cvisb:Symptom,rdf:Property,blurry_vision,If the patient reports blurry vision,True,optional,one,schema:Boolean,,,,,
cvisb:Symptom,rdf:Property,light_sensitivity,If the patient reports light sensitivity,True,optional,one,schema:Boolean,,,,,
cvisb:Symptom,rdf:Property,eye_foreign_body_sensation,If the patient reports a sensation of a foreign body in his/her eye(s),True,optional,one,schema:Boolean,,,,,
cvisb:Symptom,rdf:Property,bleeding_gums,If the patient reports bleeding gums,True,optional,one,schema:Boolean,,,,,
cvisb:Symptom,rdf:Property,bleeding_nose,If the patient reports a bloody nose,True,optional,one,schema:Boolean,,,,,
cvisb:Symptom,rdf:Property,bleeding_stools,If the patient reports bloody stools,True,optional,one,schema:Boolean,,,,,
cvisb:Symptom,rdf:Property,bleeding_vomit,If the patient reports vomited blood,True,optional,one,schema:Boolean,,,,,
cvisb:Symptom,rdf:Property,bleeding_injection,If the patient was bleeding at injection sites,True,optional,one,schema:Boolean,,,,,
cvisb:Symptom,rdf:Property,bleeding_hematoma,If the patient reports a hematoma,True,optional,one,schema:Boolean,,,,,
cvisb:Symptom,rdf:Property,bleeding_sputum,If the patient reports coughing up blood / blood in his/her sputum,True,optional,one,schema:Boolean,,,,,
cvisb:Symptom,rdf:Property,bleeding_urine,If the patient reports blood in his/her urine,True,optional,one,schema:Boolean,,,,,
cvisb:Symptom,rdf:Property,bleeding_vaginal,If the patient reports vaginal bleeding,True,optional,one,schema:Boolean,,,,,
cvisb:Symptom,rdf:Property,bleeding_other,If the patient reports any other unusual bleeding,True,optional,many,schema:Text,,,,,
cvisb:Symptom,rdf:Property,bleeding_none,If the patient reports no symptoms of bleeding,True,optional,one,schema:Boolean,,,,,
cvisb:Symptom,rdf:Property,fever,If the patient reports a fever,True,optional,one,schema:Boolean,,,,,
cvisb:Symptom,rdf:Property,conjunctivitis,If the patient reports conjunctivitis,True,optional,one,schema:Boolean,,,,,
cvisb:Symptom,rdf:Property,facialSwelling,If the patient reports facial or neck swelling,True,optional,one,schema:Boolean,,,,,
cvisb:Symptom,rdf:Property,jointSwelling,If the patient reports joint swelling,True,optional,one,schema:Boolean,,,,,
cvisb:Symptom,rdf:Property,lymphadenopathy,If the patient reports lymphadenopathy,True,optional,one,schema:Boolean,,,,,
cvisb:Symptom,rdf:Property,shortnessBreath,If the patient is observed to have shortness of breath,True,optional,one,schema:Boolean,,,,,
cvisb:Symptom,rdf:Property,rales,If the patient is observed to have rales,True,optional,one,schema:Boolean,,,,,
cvisb:Symptom,rdf:Property,crepitations,If the patient is observed to have crepitations,True,optional,one,schema:Boolean,,,,,
cvisb:Symptom,rdf:Property,abdominalTenderness,If the patient is observed to have abdominal tenderness,True,optional,one,schema:Boolean,,,,,
cvisb:Symptom,rdf:Property,hepatomegaly,If the patient is observed to have hepatomegaly,True,optional,one,schema:Boolean,,,,,
cvisb:Symptom,rdf:Property,splenomegaly,If the patient is observed to have splenomegaly,True,optional,one,schema:Boolean,,,,,
cvisb:Symptom,rdf:Property,RUQtenderness,If the patient is observed to have right upper quadrant (RUQ) tenderness,True,optional,one,schema:Boolean,,,,,
cvisb:Symptom,rdf:Property,disorientation,If the patient is reports having disorientation,True,optional,one,schema:Boolean,,,,,
cvisb:Symptom,rdf:Property,tremors,If the patient is reports having tremors,True,optional,one,schema:Boolean,,,,,
cvisb:Symptom,rdf:Property,seizures,If the patient is reports having seizures,True,optional,one,schema:Boolean,,,,,
cvisb:Symptom,rdf:Property,hiccups,If the patient is reports having hiccups,True,optional,one,schema:Boolean,,,,,
cvisb:Symptom,rdf:Property,edema,If the patient reports edema,True,optional,one,schema:Boolean,,,,,
cvisb:Symptom,rdf:Property,inflammation,If the patient reports inflammation,True,optional,one,schema:Boolean,,,,,
cvisb:Symptom,rdf:Property,rash,If the patient reports a rash,True,optional,one,schema:Boolean,,,,,
cvisb:Symptom,rdf:Property,headache,If the patient reports headaches,True,optional,one,schema:Boolean,,,,,
cvisb:Symptom,rdf:Property,soreThroat,If the patient reports a sore throat,True,optional,one,schema:Boolean,,,,,
cvisb:Symptom,rdf:Property,vomit,If the patient reports vomiting,True,optional,one,schema:Boolean,,,,,
cvisb:Symptom,rdf:Property,decreasedUrination,If the patient reports decreased urination,True,optional,one,schema:Boolean,,,,,
cvisb:Symptom,rdf:Property,cough,If the patient reports coughing,True,optional,one,schema:Boolean,,,,,
cvisb:Symptom,rdf:Property,diarrhea,If the patient reports diarrhea,True,optional,one,schema:Boolean,,,,,
cvisb:Symptom,rdf:Property,malaise,If the patient reports malaise,True,optional,one,schema:Boolean,,,,,
cvisb:Symptom,rdf:Property,appetiteLoss,If the patient reports loss of appetite,True,optional,one,schema:Boolean,,,,,
cvisb:Symptom,rdf:Property,weakness,If the patient reports weakness,True,optional,one,schema:Boolean,,,,,
cvisb:Symptom,rdf:Property,dizziness,If the patient reports dizziness,True,optional,one,schema:Boolean,,,,,
cvisb:Symptom,rdf:Property,convulsions,If the patient reports convulsions,True,optional,one,schema:Boolean,,,,,
cvisb:Symptom,rdf:Property,confusion,If the patient reports confusion,True,optional,one,schema:Boolean,,,,,
cvisb:Symptom,rdf:Property,jaundice,If the patient reports  jaundice,True,optional,one,schema:Boolean,,,,,
cvisb:Symptom,rdf:Property,dyspnea,If the patient reports dyspnea,True,optional,one,schema:Boolean,,,,,
cvisb:Symptom,rdf:Property,noSymptoms,If the patient reports no symptoms,True,optional,one,schema:Boolean,,,,,
cvisb:Symptom,rdf:Property,otherSymptoms,If the patient reports other symptoms,True,optional,many,schema:Text,,,,,
,rdfs:Class,SymptomList,A schema describing an SymptomList for a Patient in the Center for Viral Systems Biology experiments,,,,,,,,schema:Thing,
cvisb:SymptomList,rdf:Property,timepoint,"Description of when the symptoms were observed (e.g. at survivor enrollment, initial presentation in hospital, etc.)",True,required,one,schema:Text,,,,,
cvisb:SymptomList,rdf:Property,daysSinceAdmit,"Number of days between the admission date and when symptoms were observed. At initial clinical presentation, daysSinceAdmit = 0",True,recommended,one,schema:Integer,,,,,
cvisb:SymptomList,rdf:Property,symptoms,Array of symptoms observed in or reported by the patient at the timepoint.,True,required,one,cvisb:Symptom,,,,,
,rdfs:Class,SystemsSerology,A schema describing a Systems Serology Experiment in the Center for Viral Systems Biology,,,,,,,,schema:Thing,
cvisb:SystemsSerology,rdf:Property,assayType,"Type of Systems Serology assay.  Options: ADNP, ADCD, ADCP, NKD-CD107a, NKD-IFNg, NKD-MIP-1b",False,required,many,"xsd:string, schema:Text",,,,,
cvisb:SystemsSerology,rdf:Property,assayReadout,"Type of assay readout, such as phagocytic score, C3 deposition MFI",False,recommended,many,"xsd:string, schema:Text",,,,,
cvisb:SystemsSerology,rdf:Property,sampleDilution,Dilution of sample,False,recommended,many,"xsd:string, schema:Text",,,,,
cvisb:SystemsSerology,rdf:Property,assayResult,Assay result,False,recommended,many,"xsd:string, schema:Text",,,,,
,rdfs:Class,SystolicPressure,A schema describing a single systolic blood pressure datapoint collected from patients in the Center for Viral Systems Biology.,,,,,,,,cvisb:Data,
cvisb:SystolicPressure,rdf:Property,time,Date and time of SystolicPressure measurement,True,recommended,one,schema:DateTime,,,,,
cvisb:SystolicPressure,rdf:Property,systolicPressure,"Systolic Pressure, in mmHg",True,required,one,schema:Integer,,,,,
,rdfs:Class,UpdateLog,A schema describing a UpdateLog in the Center for Viral Systems Biology experiments. Used to keep track of specific changes to metadata.,,,,,,,,health:UpdateLog,
cvisb:UpdateLog,rdf:Property,notes,Text log describing why changes were made.,True,required,one,schema:Text,,,,,
cvisb:UpdateLog,rdf:Property,updatedBy,Who made the update,True,recommended,one,schema:Text,,,,,
cvisb:UpdateLog,rdf:Property,dateModified,When the update happened,True,required,one,schema:Text,,,,,schema:dateModified
cvisb:UpdateLog,rdf:Property,updatedVariables,A list of variables/fields affected by the changes.,True,recommended,many,schema:Text,,,,,
,rdfs:Class,ViralSeqData,A schema describing viral sequencing data in the Center for Viral Systems Biology.,,,,,,,,cvisb:Data,
cvisb:ViralSeqData,rdf:Property,virus,Virus sequenced,False,required,one,"xsd:string, schema:Text",,,,,
cvisb:ViralSeqData,rdf:Property,referenceSeq,reference sequence used for alignment.,False,required,one,"xsd:string, schema:Text",,,,,
cvisb:ViralSeqData,rdf:Property,isReferenceSeq,Whether the data is a reference sequence,False,required,one,schema:Boolean,,,,,
