Class,@type,variable,description,authenticated,marginality,cardinality,type,enumeration,minimum,maximum,derived_from,schema:sameAs
,rdfs:Class,Accelerometry,A schema describing a single accelerometry datapoint collected from patients in the Center for Viral Systems Biology.,,,,,,,,cvisb:Data,
cvisb:Accelerometry,rdf:Property,time,Date and time of Accelerometry measurement,True,recommended,one,schema:DateTime,,,,,
cvisb:Accelerometry,rdf:Property,x,Displacement of the body / sensor in the x-direction,True,required,one,schema:Float,,,,,
cvisb:Accelerometry,rdf:Property,y,Displacement of the body / sensor in the y-direction,True,required,one,schema:Float,,,,,
cvisb:Accelerometry,rdf:Property,z,Displacement of the body / sensor in the z-direction,True,required,one,schema:Float,,,,,
cvisb:Accelerometry,rdf:Property,collectionInstrument,Whether the measurement was recorded using a PhysIQ sensor or a conventional measurement by a nurse/doctor,True,recommended,one,schema:Text,"['PhysIQ', 'conventional']",,,,
,rdfs:Class,AdministrativeArea,"A schema describing a geographic AdministrativeArea in the Center for Viral Systems Biology. Used typically to specify province, district, village, etc. for regions of a Country. Note that for Administrative Unit 0 `Country` should be used instead",,,,,,,,cvisb:Place,schema:AdministrativeArea
