Class,@type,variable,description,authenticated,marginality,cardinality,type,enumeration,minimum,maximum,derived_from,schema:sameAs
cvisb:AdministrativeArea,rdf:Property,alternateName,"Alternative name of the admin area, for instance in a different language",False,optional,many,"xsd:string, schema:Text",,,,,schema:alternateName
cvisb:AdministrativeArea,rdf:Property,administrativeType,"Type of administative area, e.g. province (Adm 1), district (Adm 2), chiefdom (Adm 3), village (Adm 4)",False,required,one,"xsd:string, schema:Text","['province', 'district', 'chiefdom', 'village', 'Federal Capital Territory', 'state', 'Local Government Area', 'ward']",,,,
cvisb:AdministrativeArea,rdf:Property,administrativeUnit,"level of administative area, e.g. 1: province, 2: district, 3: chiefdom, 4: village for Sierra Leone",False,recommended,one,schema:Integer,"[0, 1, 2, 3, 4, None]",,,,
cvisb:AdministrativeArea,rdf:Property,identifier,"identifier  / short name for administrative area. Note: where possible, align to governmental codes for the Administrative Area",False,optional,one,"xsd:string, schema:Text",,,,,schema:identifier
,rdfs:Class,AndersenSequencing,"A schema describing a HLA, viral, or metagenome sequencing Experiment in the Center for Viral Systems Biology",,,,,,,,cvisb:sequencingExperiment,
cvisb:AndersenSequencing,rdf:Property,analysisVersion,Analysis pipeline version,False,recommended,one,"xsd:string, schema:Text",,,,,
cvisb:AndersenSequencing,rdf:Property,metagenomeDatabase,metagenome database,False,recommended,one,"xsd:string, schema:Text",,,,,
cvisb:AndersenSequencing,rdf:Property,metagenomeDBVersion,metagenome database version,False,recommended,one,"schema:URL, xsd:string, schema:Text",,,,,
cvisb:AndersenSequencing,rdf:Property,assemblyReference,Reference for assembly,False,recommended,one,"schema:URL, xsd:string, schema:Text",,,,,
cvisb:AndersenSequencing,rdf:Property,alignmentReference,Reference for alignment,False,recommended,one,"schema:URL, xsd:string, schema:Text",,,,,
cvisb:AndersenSequencing,rdf:Property,libraryKit,library kit,False,recommended,one,"xsd:string, schema:Text",,,,,
cvisb:AndersenSequencing,rdf:Property,libraryVersion,library version,False,recommended,one,"xsd:string, schema:Text",,,,,
cvisb:AndersenSequencing,rdf:Property,variantCallingType,Variant calling Type(Consensus/Reference),False,recommended,one,"xsd:string, schema:Text",,,,,
cvisb:AndersenSequencing,rdf:Property,replicate,Replicate number,False,recommended,one,schema:Integer,,,,,
,rdfs:Class,BodyTemperature,A schema describing a single core body temperature datapoint collected from patients in the Center for Viral Systems Biology.,,,,,,,,cvisb:Data,
cvisb:BodyTemperature,rdf:Property,time,Date and time of BodyTemperature measurement,True,recommended,one,schema:DateTime,,,,,
cvisb:BodyTemperature,rdf:Property,bodyTemperature,"Core body temperature, in degrees Celsius",True,required,one,schema:Float,,,,,
,rdfs:Class,ComaScore,"A schema describing a series of observations about a patient, to calculate a Glasgow Coma Score in the Center for Viral Systems Biology experiments",,,,,,,,schema:Thing,
cvisb:ComaScore,rdf:Property,daysSinceAdmit,"Number of days between the admission date and when when the coma score was evaluated. At initial clinical presentation, daysSinceAdmit = 0",True,recommended,one,schema:Integer,,,,,
cvisb:ComaScore,rdf:Property,glasgowComaScore,Combined Glasgow Coma Score,True,recommended,one,schema:Integer,,3.0,15.0,,
cvisb:ComaScore,rdf:Property,eyeOpening,"How a patient opens his/her eyes: Spontaneously (4), to speech (3), to pain (2), none (1)",True,recommended,one,schema:Integer,,1.0,4.0,,
cvisb:ComaScore,rdf:Property,verbalResponse,"How a patient verbally communicates: oriented (5), confused (4), Inappropriate (3), Incomprehensible (2), none (1)",True,recommended,one,schema:Integer,,1.0,5.0,,
cvisb:ComaScore,rdf:Property,motorResponse,"Motor response of patient: obeys commands (6), localizes to pain (5), withdraws from pain (4), flexion to pain (3), extension to pain (2), none (1)",True,recommended,one,schema:Integer,,1.0,6.0,,
,rdfs:Class,ContactPoint,A schema describing a ContactPoint for the Center for Viral Systems Biology,,,,,,,,schema:ContactPoint,schema:ContactPoint
cvisb:ContactPoint,rdf:Property,contactType,contact type of the contactPoint,False,required,one,"xsd:string, schema:Text","['technical support', 'customer support']",,,,schema:contactType
cvisb:ContactPoint,rdf:Property,url,url of the contactPoint,False,required,one,"xsd:string, schema:Text",,,,,schema:url
cvisb:ContactPoint,rdf:Property,email,email of the contactPoint,False,recommended,one,"xsd:string, schema:Text",,,,,schema:email
,rdfs:Class,Country,A schema describing a Country in the Center for Viral Systems Biology experiments,,,,,,,,schema:Country,schema:Country
cvisb:Country,rdf:Property,identifier,"2 letter ISO code of the country, e.g. SL",False,recommended,one,"xsd:string, schema:Text","['SL', 'NG', 'LR', 'GN', None]",,,,schema:identifier
cvisb:Country,rdf:Property,url,Link to the ISO country page,False,recommended,one,"xsd:string, schema:Text","['https://www.iso.org/obp/ui/#iso:code:3166:SL', 'https://www.iso.org/obp/ui/#iso:code:3166:NG', 'https://www.iso.org/obp/ui/#iso:code:3166:LR', 'https://www.iso.org/obp/ui/#iso:code:3166:GN', None]",,,,schema:url
cvisb:Country,rdf:Property,name,"Name of the country, e.g. Sierra Leone",False,required,one,"xsd:string, schema:Text","['Sierra Leone', 'Nigeria', 'Liberia', 'Guinea']",,,,schema:name
cvisb:Country,rdf:Property,alternateName,"Alternative name of the country, for instance in a different language",False,optional,many,"xsd:string, schema:Text",,,,,schema:alternateName
,rdfs:Class,Data,A schema describing generic Data in the Center for Viral Systems Biology. Data are typically a summarization of data collected in an experiment for a given sample.,,,,,,,,schema:Thing,
cvisb:Data,rdf:Property,timepoint,"Description of when the data was taken (e.g. at survivor enrollment, initial presentation in hospital, etc.)",False,recommended,one,schema:Text,,,,,
cvisb:Data,rdf:Property,daysSinceAdmit,"Number of days between the admission date and when data were measured. At initial clinical presentation, daysSinceAdmit = 0",True,recommended,one,schema:Integer,,,,,
,rdfs:Class,DataCatalog,A schema describing the DataCatalog for the Center for Viral Systems Biology experiments,,,,,,,,schema:DataCatalog,schema:DataCatalog
cvisb:DataCatalog,rdf:Property,name,Descriptive name of the DataCatalog,False,required,one,"xsd:string, schema:Text",,,,,schema:name
cvisb:DataCatalog,rdf:Property,alternateName,Alternate name of the DataCatalog,False,optional,many,"xsd:string, schema:Text",,,,,schema:alternateName
cvisb:DataCatalog,rdf:Property,description,Short summary describing a DataCatalog,False,required,one,"xsd:string, schema:Text",,,,,schema:description
cvisb:DataCatalog,rdf:Property,url,Location of a page describing the DataCatalog,False,optional,one,schema:URL,,,,,schema:url
cvisb:DataCatalog,rdf:Property,dataset,list of unique internal identifiers for the datasets associated with the DataCatalog,False,required,many,xsd:string,,,,,schema:dataset
cvisb:DataCatalog,rdf:Property,identifier,"A unique identifier for the DataCatalog. Note: should be an internal, CViSB identifier; DOIs should go in @id",False,recommended,one,xsd:string,,,,,schema:identifier
cvisb:DataCatalog,rdf:Property,@id,"A unique identifier for the DataCatalog, preferably a DOI",False,recommended,one,schema:URL,,,,,schema:identifier
cvisb:DataCatalog,rdf:Property,sameAs,URL to cross-reference other copies of the DataCatalog,False,optional,many,schema:URL,,,,,schema:sameAs
cvisb:DataCatalog,rdf:Property,keywords,Comma-seperated keywords to summarize the DataCatalog,False,recommended,many,xsd:string,,,,,schema:keywords
cvisb:DataCatalog,rdf:Property,datePublished,Date of first broadcast/publication,False,recommended,one,schema:Date,,,,,schema:datePublished
cvisb:DataCatalog,rdf:Property,dateModified,Date on which the DataCatalog was most recently modified,False,required,one,schema:Date,,,,,schema:dateModified
cvisb:DataCatalog,rdf:Property,updatedBy,Person who updated the data catalog data,True,recommended,one,"xsd:string, schema:Text",,,,,
cvisb:DataCatalog,rdf:Property,temporalCoverage,"The temporalCoverage of a DataCatalog indicates the period that the content applies to, i.e. that it describes, either as a DateTime or as a textual string indicating a time period in ISO 8601 time interval format.",False,recommended,one,cvisb:DateRange,,,,,schema:temporalCoverage
cvisb:DataCatalog,rdf:Property,spatialCoverage,Countries from which patients in the DataCatalog come,False,recommended,many,cvisb:Country,,,,,schema:spatialCoverage
cvisb:DataCatalog,rdf:Property,publisher,"Publisher of this DataCatalog, usually the host organization",False,recommended,many,cvisb:Organization,,,,,schema:publisher
cvisb:DataCatalog,rdf:Property,_version,"Version of DataCatalog, auto-assigned by CViSB database",False,recommended,one,schema:Number,,,,,schema:version
cvisb:DataCatalog,rdf:Property,releaseVersion,"Formal release version of CViSB data catalog, manually created. Assigned in the style of https://semver.org/, where version number is formatted like MAJOR.MINOR.PATCH",False,required,one,schema:Text,,,,,schema:schemaVersion
cvisb:DataCatalog,rdf:Property,schemaVersion,Version of DataCatalog schema,False,recommended,one,schema:Text,,,,,schema:schemaVersion
cvisb:DataCatalog,rdf:Property,funder,A person or organization that supports (sponsors) the collection of this dataset through some kind of financial contribution,False,recommended,many,cvisb:Organization,,,,,schema:funder
,rdfs:Class,DataDownload,A schema describing DataDownload in the Center for Viral Systems Biology,,,,,,,,schema:DataDownload,
cvisb:DataDownload,rdf:Property,name,Descriptive name of the data file,False,required,one,"xsd:string, schema:Text",,,,,schema:name
cvisb:DataDownload,rdf:Property,description,Short summary describing a data file,False,recommended,one,"xsd:string, schema:Text",,,,,schema:description
cvisb:DataDownload,rdf:Property,includedInDataset,"A unique identifier for the Dataset that the DataDownload is contained in. Note: should be an internal, CViSB identifier;",False,required,one,xsd:string,,,,,schema:identifier
cvisb:DataDownload,rdf:Property,identifier,"A unique identifier for the DataDownload. Note: should be an internal, CViSB identifier; DOIs should go in @id",False,required,one,xsd:string,,,,,schema:identifier
cvisb:DataDownload,rdf:Property,@id,"A unique identifier for the dataset, preferably a DOI",False,recommended,one,schema:URL,,,,,schema:identifier
cvisb:DataDownload,rdf:Property,isBasedOn,"A reference to the identifier of a parent file(s), e.g. raw data that this analysis file is based on",False,recommended,many,xsd:string,,,,,schema:isBasedOn
cvisb:DataDownload,rdf:Property,_version,"Version of data file, auto-assigned by CViSB database",False,recommended,one,schema:Number,,,,,schema:version
cvisb:DataDownload,rdf:Property,contentUrl,URL pointing to the actual location of the file,False,required,one,schema:URL,,,,,schema:contentUrl
cvisb:DataDownload,rdf:Property,contentUrlRepository,"Name of the repository where the file is stored, e.g. the NIH's Sequence Read Archive",False,recommended,one,schema:Text,"['SRA', 'AWS', 'GitHub', None]",,,,
cvisb:DataDownload,rdf:Property,contentUrlIdentifier,"Unique identifier used at the contentUrl location, for instance the NIH SRA id for the file/sample or Accession number",False,recommended,one,schema:Text,,,,,
cvisb:DataDownload,rdf:Property,publication,"Journal article or other publication associated with the dataset (stored as an object, not a string)",False,recommended,many,cvisb:ScholarlyArticle,,,,,schema:publication
cvisb:DataDownload,rdf:Property,sameAs,URL to cross-reference other copies of the data file,False,optional,many,schema:URL,,,,,schema:sameAs
cvisb:DataDownload,rdf:Property,additionalType,"Type of data download file, such as raw data, processed data, summary data",False,required,one,xsd:string,"['raw data', 'analyzed data', 'summary data']",,,,
cvisb:DataDownload,rdf:Property,keywords,Comma-seperated keywords to summarize the DataDownload,False,recommended,many,xsd:string,,,,,schema:keywords
cvisb:DataDownload,rdf:Property,measurementTechnique,"A technique or technology used in a Dataset (or DataDownload, DataCatalog), corresponding to the method used for measuring the corresponding variable(s) (described using variableMeasured).",False,required,one,"xsd:string, schema:Text","['HLA sequencing', 'viral sequencing', 'metagenome sequencing', 'BCR sequencing', 'TCR sequencing', 'Systems Serology', 'Metabolomics', 'blood chemistry', 'vitals', 'other']",,,,schema:measurementTechnique
cvisb:DataDownload,rdf:Property,encodingFormat,File extension,False,recommended,one,"xsd:string, schema:Text","['text/csv', 'text/plain', 'text/fasta', 'text/bed', 'text/html', 'application/json', 'application/bam', 'application/vnd.ms-excel', 'application/vnd.openxmlformats-officedocument.spreadsheetml.sheet', 'application/xml', 'application/zip', 'application/gzip', None]",,,,schema:encodingFormat
cvisb:DataDownload,rdf:Property,dateCreated,Date of first creation,False,recommended,one,schema:Date,,,,,schema:dateCreated
cvisb:DataDownload,rdf:Property,datePublished,Date of first broadcast/publication,False,recommended,one,schema:Date,,,,,schema:datePublished
cvisb:DataDownload,rdf:Property,dateModified,Date on which the DataDownload was most recently modified (YYYY-DD-MM),False,required,one,schema:Date,,,,,schema:dateModified
cvisb:DataDownload,rdf:Property,updatedBy,Person who updated the data download data,True,recommended,one,"xsd:string, schema:Text",,,,,
cvisb:DataDownload,rdf:Property,author,"Author of this DataDownload, can be a person or an organization. Usually specified in Dataset object.",False,optional,many,cvisb:Organization,,,,,schema:author
cvisb:DataDownload,rdf:Property,publisher,"Publisher of this dataset, usually the host organization",False,recommended,many,cvisb:Organization,,,,,schema:publisher
cvisb:DataDownload,rdf:Property,sourceCode,"Computer programming source code. Example: Full (compile ready) solutions, code snippet samples, scripts, templates.",False,recommended,many,cvisb:SoftwareSourceCode,,,,,
cvisb:DataDownload,rdf:Property,experimentIDs,"Unique experimental ID that of the experiment that generated the data. Used as a handle into the metadata describing how the data were generated, processed, and analysed.",False,required,many,"xsd:string, schema:Text",,,,,
,rdfs:Class,Dataset,"A schema describing Dataset in the Center for Viral Systems Biology. A dataset is a collection of data of a particular experimental type and may contain information on suspected Lassa cases, suspected Ebola cases, contacts of suspected cases, and/or controls.",,,,,,,,schema:Dataset,
cvisb:Dataset,rdf:Property,name,Descriptive name of the dataset,False,required,one,"xsd:string, schema:Text",,,,,schema:name
cvisb:Dataset,rdf:Property,description,Short summary describing a dataset,False,required,one,"xsd:string, schema:Text",,,,,schema:description
cvisb:Dataset,rdf:Property,measurementTechnique,"A technique or technology used in a Dataset (or DataDownload, DataCatalog), corresponding to the method used for measuring the corresponding variable(s) (described using variableMeasured).",False,required,one,"xsd:string, schema:Text","['HLA sequencing', 'viral sequencing', 'metagenome sequencing', 'BCR sequencing', 'TCR sequencing', 'Systems Serology', 'metabolomics', 'blood chemistry', 'vitals', 'other']",,,,schema:measurementTechnique
cvisb:Dataset,rdf:Property,variableMeasured,"A technique or technology used in a Dataset (or DataDownload, DataCatalog), corresponding to the method used for measuring the corresponding variable(s) (described using variableMeasured).",False,recommended,many,"xsd:string, schema:Text",,,,,schema:variableMeasured
cvisb:Dataset,rdf:Property,url,Location of a page describing the dataset,False,optional,one,schema:URL,,,,,schema:url
cvisb:Dataset,rdf:Property,includedInDataCatalog,A data catalog which contains this dataset,False,recommended,many,schema:URL,,,,,schema:includedInDataCatalog
cvisb:Dataset,rdf:Property,identifier,"A unique identifier for the Dataset. Note: should be an internal, CViSB identifier; DOIs should go in @id",False,required,one,xsd:string,"['hla', 'viralseq', 'metagenomeseq', 'bcr', 'tcr', 'systemsserology', 'metabolomics']",,,,schema:identifier
cvisb:Dataset,rdf:Property,@id,"A unique identifier for the dataset, preferably a DOI",False,recommended,one,schema:URL,,,,,schema:identifier
cvisb:Dataset,rdf:Property,sameAs,URL to cross-reference other copies of the dataset,False,optional,many,schema:URL,,,,,schema:sameAs
cvisb:Dataset,rdf:Property,keywords,Comma-seperated keywords to summarize the dataset,False,recommended,many,xsd:string,,,,,schema:keywords
cvisb:Dataset,rdf:Property,datePublished,Date of first broadcast/publication,False,recommended,one,schema:Date,,,,,schema:datePublished
cvisb:Dataset,rdf:Property,dateModified,Date on which the dataset was most recently modified,False,required,one,schema:Date,,,,,schema:dateModified
cvisb:Dataset,rdf:Property,updatedBy,Person who updated the dataset data,True,recommended,one,"xsd:string, schema:Text",,,,,
cvisb:Dataset,rdf:Property,temporalCoverage,"The temporalCoverage of a dataset indicates the period that the content applies to, i.e. that it describes, either as a DateTime or as a textual string indicating a time period in ISO 8601 time interval format.",False,recommended,one,cvisb:DateRange,,,,,schema:temporalCoverage
cvisb:Dataset,rdf:Property,spatialCoverage,"The spatialCoverage of a CreativeWork indicates the place(s) which are the focus of the content. It is a subproperty of contentLocation intended primarily for more technical and detailed materials. For example with a Dataset, it indicates areas that the dataset describes: a dataset of New York weather would have spatialCoverage which was the place: the state of New York.",False,recommended,many,cvisb:Country,,,,,schema:spatialCoverage
cvisb:Dataset,rdf:Property,author,"Author of this dataset, can be a person or an organization",False,required,many,cvisb:Organization,,,,,schema:author
cvisb:Dataset,rdf:Property,publisher,"Publisher of this dataset, usually the host organization",False,recommended,many,cvisb:Organization,,,,,schema:publisher
cvisb:Dataset,rdf:Property,_version,"Version of dataset, auto-assigned by CViSB database",False,recommended,one,schema:Number,,,,,schema:version
cvisb:Dataset,rdf:Property,schemaVersion,Version of Dataset schema,False,recommended,one,schema:Text,,,,,schema:schemaVersion
cvisb:Dataset,rdf:Property,dataDownloadIDs,"References to the CViSB ID for the DataDownload, where elements of the dataset can be downloaded. Used to link Datasets to DataDownloads",False,required,many,schema:Text,,,,,
cvisb:Dataset,rdf:Property,distribution,"DataDownload objects, which contain the URL link to download the raw, analyzed, and summary data associated with the dataset as well as associated metadata for the file.",False,recommended,many,cvisb:DataDownload,,,,,
cvisb:Dataset,rdf:Property,sourceCode,"Computer programming source code. Example: Full (compile ready) solutions, code snippet samples, scripts, templates.",False,recommended,many,cvisb:SoftwareSourceCode,,,,,
cvisb:Dataset,rdf:Property,publication,Citation string (not an object) for the journal article or other publication associated with the dataset,False,recommended,many,schema:Text,,,,,schema:publication
cvisb:Dataset,rdf:Property,citation,"Journal article or other publication associated with the dataset (stored as an object, not a string)",False,recommended,many,cvisb:ScholarlyArticle,,,,,schema:citation
cvisb:Dataset,rdf:Property,funder,A person or organization that supports (sponsors) the collection of this dataset through some kind of financial contribution,False,recommended,many,cvisb:Organization,,,,,schema:funder
cvisb:Dataset,rdf:Property,license,"A license document that applies to this content, typically indicated by URL.",False,recommended,one,schema:URL,,,,,schema:license
,rdfs:Class,DateRange,"A derivation of the schema.org Date class, for explicit bounded or unbounded date ranges. Used in json validation.",,,,,,,,schema:Date,schema:Date
cvisb:DateRange,rdf:Property,lte,Inclusive upper bound of a date range,False,recommended,one,"xsd:string, schema:Text",,,,,
cvisb:DateRange,rdf:Property,lt,Exclusive upper bound of a date range,False,recommended,one,"xsd:string, schema:Text",,,,,
cvisb:DateRange,rdf:Property,gte,Inclusive lower bound of a date range,False,recommended,one,"xsd:string, schema:Text",,,,,
cvisb:DateRange,rdf:Property,gt,Exclusive lower bound of a date range,False,recommended,one,"xsd:string, schema:Text",,,,,
,rdfs:Class,DerivedSample,A schema describing a derived sample from a primary source in the Center for Viral Systems Biology,,,,,,,,cvisb:Sample,
cvisb:DerivedSample,rdf:Property,sourceSampleID,Sample ID for the primary source of the derived sample,True,required,many,"xsd:string, schema:Text",,,,,
cvisb:DerivedSample,rdf:Property,sourceSampleType,Sample ID for the primary source of the derived sample,False,required,one,"xsd:string, schema:Text","['blood_purple-EDTA', 'blood_blue-citrate', 'blood_mixed', 'blood_unknown', 'urine', 'feces', 'organs', 'tissue', 'plasma', 'serum', 'plasma_or_serum', 'buffy_coat', 'PBMC', 'frozenPBMC-DNA', 'frozenPBMC-RNA', 'viralRNA', 'totalRNA', 'DNA']",,,,
cvisb:DerivedSample,rdf:Property,primarySampleDate,"Date of *primary* sample creation/collection (e.g. blood draw, tissue sample, urine/feces collection) (YYYY-MM-DD)",False,recommended,one,cvisb:Date,,,,,
,rdfs:Class,DiastolicPressure,A schema describing a single diastolic blood pressure datapoint collected from patients in the Center for Viral Systems Biology.,,,,,,,,cvisb:Data,
cvisb:DiastolicPressure,rdf:Property,time,Date and time of DiastolicPressure measurement,True,recommended,one,schema:DateTime,,,,,
cvisb:DiastolicPressure,rdf:Property,diastolicPressure,"Diastolic Pressure, in mmHg",True,required,one,schema:Integer,,,,,
,rdfs:Class,ECGPoint,A schema describing a single ECG datapoint collected from patients in the Center for Viral Systems Biology.,,,,,,,,cvisb:Data,
cvisb:ECGPoint,rdf:Property,time,Date and time of ECGPoint measurement,True,recommended,one,schema:DateTime,,,,,
cvisb:ECGPoint,rdf:Property,voltage,"ECG voltage, in mV",True,required,one,schema:Float,,,,,
cvisb:ECGPoint,rdf:Property,collectionInstrument,Whether the measurement was recorded using a PhysIQ sensor or a conventional measurement by a nurse/doctor,True,recommended,one,schema:Text,"['PhysIQ', 'conventional']",,,,
,rdfs:Class,ELISA,A schema describing an ELISA result for a Patient in the Center for Viral Systems Biology experiments,,,,,,,,schema:Thing,
cvisb:ELISA,rdf:Property,virus,Virus tested in ELISA (Ebola or Lassa),False,required,one,schema:Text,"['Ebola', 'Lassa']",,,,
cvisb:ELISA,rdf:Property,assayType,"Type of ELISA: IgG, IgM, or Ag",False,required,one,schema:Text,"['IgG', 'IgM', 'Ag']",,,,
cvisb:ELISA,rdf:Property,ELISAresult,"Result of ELISA, either positive/negative/indeterminate",False,recommended,one,schema:Text,"['positive', 'negative', 'indeterminate', None]",,,,
cvisb:ELISA,rdf:Property,ELISAvalue,"Result of ELISA, as a quantitative calibrated value",False,recommended,one,schema:Number,,,,,
cvisb:ELISA,rdf:Property,sampleID,sampleID associated with the ELISA measurement,True,optional,one,schema:Text,,,,,
cvisb:ELISA,rdf:Property,timepoint,"description of the time at which the ELISA was taken, e.g. at patient presentation, survivor enrollment etc.",False,recommended,one,schema:Text,,,,,
,rdfs:Class,Experiment,A schema describing an Experiment in the Center for Viral Systems Biology. An experiment is a measurement (specified by measurementTechnique) of a specific sample (e.g. a particular timepoint for a Patient).,,,,,,,,schema:Thing,
cvisb:Experiment,rdf:Property,experimentID,unique experiment ID for that sample analysed by that experimental method,False,required,one,"xsd:string, schema:Text",,,,,
cvisb:Experiment,rdf:Property,batchID,unique batch ID created by the lab doing the experiment,False,recommended,many,"xsd:string, schema:Text",,,,,
cvisb:Experiment,rdf:Property,sampleID,Sample ID used in the experiment,True,recommended,one,"xsd:string, schema:Text",,,,,
cvisb:Experiment,rdf:Property,patientID,Public Patient IDs used within the experiment,False,recommended,one,"xsd:string, schema:Text",,,,,
cvisb:Experiment,rdf:Property,privatePatientID,Private Patient ID used within the experiment. Link to patient metadata properties,True,required,one,"xsd:string, schema:Text",,,,,
cvisb:Experiment,rdf:Property,SRA_ID,ID used by the National Center for Biotechnology Information (NCBI) to identify the data within the Sequence Read Archive (SRA),False,recommended,one,"xsd:string, schema:Text",,,,,
cvisb:Experiment,rdf:Property,GenBank_ID,"ID used to identify the data within GenBank, the NIH's genetic sequence database",False,recommended,one,"xsd:string, schema:Text",,,,,
cvisb:Experiment,rdf:Property,name,Descriptive name of the experiment,False,optional,one,"xsd:string, schema:Text",,,,,schema:name
cvisb:Experiment,rdf:Property,description,Short description of the experiment,False,optional,one,"xsd:string, schema:Text",,,,,schema:description
cvisb:Experiment,rdf:Property,experimentDate,Date of the Experiment,False,recommended,one,schema:Date,,,,,
